{
  "schemaVersion": 1,
  "tool": {
    "name": "agent-eval-lab",
    "version": "0.1.0"
  },
  "run": {
    "id": "00000000-0000-4000-8000-000000000001",
    "startedAt": "2026-01-01T00:00:00.000Z",
    "endedAt": "2026-01-01T00:00:00.000Z",
    "durationMs": 0
  },
  "project": {
    "name": "SYNTHETIC UI CONTRACT FIXTURE — not an actual run"
  },
  "status": "passed",
  "exitCode": 0,
  "score": 100,
  "scoreComplete": true,
  "summary": {
    "pass": 2,
    "fail": 0,
    "error": 0,
    "skipped": 0,
    "required": 2,
    "optional": 0,
    "total": 2,
    "optionalFailures": 0
  },
  "checks": [
    {
      "id": "tests",
      "label": "Tests",
      "kind": "command",
      "required": true,
      "status": "pass",
      "durationMs": 0,
      "exitCode": 0,
      "reason": null,
      "command": "npm",
      "args": [
        "run",
        "test",
        "--",
        "--run"
      ],
      "timedOut": false,
      "signal": null,
      "stdout": "Synthetic captured prefix",
      "stderr": "",
      "outputTruncated": true
    },
    {
      "id": "typecheck",
      "label": "Typecheck",
      "kind": "command",
      "required": true,
      "status": "pass",
      "durationMs": 0,
      "exitCode": 0,
      "reason": null,
      "command": "npm",
      "args": [
        "run",
        "typecheck"
      ],
      "timedOut": false,
      "signal": null,
      "stdout": "",
      "stderr": "",
      "outputTruncated": false
    }
  ],
  "git": {
    "enabled": false,
    "baseRef": null,
    "baseSha": null,
    "capturedAt": "2026-10-18T08:50:42.569Z",
    "timing": "before-commands",
    "changes": [],
    "stats": {
      "files": 0,
      "additions": 0,
      "deletions": 0,
      "incomplete": false
    }
  },
  "warnings": [],
  "errors": []
}
